{
  "session_metadata": {
    "schema_version": "0.1.0",
    "session_id": "L25P04_1files",
    "language_codes": [
      "it",
      "en"
    ],
    "supports_mixed_language": true,
    "processing_status": "ready",
    "metadata": {
      "normalized_audio_format": "wav",
      "normalized_audio_sample_rate": 16000,
      "normalized_audio_channels": 1,
      "normalized_audio_bit_depth": 16,
      "transcription_backend": "faster-whisper",
      "transcription_model_name": "small",
      "transcription_language_mode": "auto",
      "transcription_cache_enabled": true,
      "transcription_cache_hit_count": 1,
      "merged_transcript_unit_count": 60,
      "merged_transcript_languages": [
        "it"
      ],
      "segmentation_debug": {
        "segmentation_mode": "windowed",
        "segment_count": 8,
        "closing_reason_counts": {
          "end_of_transcript": 1,
          "window_end": 7
        },
        "average_units_per_segment": 7.5,
        "average_segment_text_length": 673.375,
        "soft_boundary_override_count": 0,
        "window_seconds": 60.0,
        "window_overlap_seconds": 0.0,
        "window_min_units": 1
      },
      "segmentation_mode": "windowed",
      "segment_count": 8
    }
  },
  "input_sources": [
    {
      "source_id": "source_001",
      "original_path": "/Users/matteopogetta/Documents/ExerPlazaProject/sample_inputs/L25P04.mp4",
      "media_type": "video",
      "order_index": 1,
      "original_filename": "L25P04.mp4",
      "metadata": {}
    }
  ],
  "audio_sources": [
    {
      "audio_source_id": "audio_source_001",
      "input_source_id": "source_001",
      "audio_path": "/Users/matteopogetta/Documents/ExerPlazaProject/artifacts/normalized_audio/001_l25p04_mono_16000hz.wav",
      "normalized_asset": {
        "source_path": "/Users/matteopogetta/Documents/ExerPlazaProject/sample_inputs/L25P04.mp4",
        "source_filename": "L25P04.mp4",
        "source_last_modified_ns": 1775589703814398621,
        "output_format": "wav",
        "sample_rate": 16000,
        "channels": 1,
        "bit_depth": 16,
        "derived_path": "/Users/matteopogetta/Documents/ExerPlazaProject/artifacts/normalized_audio/001_l25p04_mono_16000hz.wav",
        "duration_seconds": 494.869313
      },
      "audio_format": "wav",
      "duration_seconds": 494.869313,
      "order_index": 1,
      "extracted_from_video": true,
      "processing_status": "ready",
      "metadata": {
        "original_media_type": "video",
        "original_path": "/Users/matteopogetta/Documents/ExerPlazaProject/sample_inputs/L25P04.mp4",
        "normalized_audio_path": "/Users/matteopogetta/Documents/ExerPlazaProject/artifacts/normalized_audio/001_l25p04_mono_16000hz.wav",
        "normalized_audio_metadata_path": "/Users/matteopogetta/Documents/ExerPlazaProject/artifacts/normalized_audio/001_l25p04_mono_16000hz.wav.metadata.json",
        "normalization": {
          "source_path": "/Users/matteopogetta/Documents/ExerPlazaProject/sample_inputs/L25P04.mp4",
          "source_filename": "L25P04.mp4",
          "source_last_modified_ns": 1775589703814398621,
          "output_format": "wav",
          "sample_rate": 16000,
          "channels": 1,
          "bit_depth": 16,
          "derived_path": "/Users/matteopogetta/Documents/ExerPlazaProject/artifacts/normalized_audio/001_l25p04_mono_16000hz.wav",
          "duration_seconds": 494.869313,
          "cache_hit": false
        },
        "transcription": {
          "backend": "faster-whisper",
          "chunk_count": 60,
          "empty_result": false,
          "detected_language": "it",
          "language_confidence": 0.9942359328269958,
          "cache_enabled": true,
          "cache_hit": true,
          "cache_format": "manifest",
          "cache_text_path": "/Users/matteopogetta/Documents/ExerPlazaProject/sample_inputs/L25P04.txt",
          "cache_manifest_path": "/Users/matteopogetta/Documents/ExerPlazaProject/sample_inputs/L25P04.transcription.json"
        }
      }
    }
  ],
  "transcript": {
    "full_text": "LTI, se e solo se, H. Allora, vediamo lì in maniera discreta. Io facciamo finta di\navere un ingresso nel tempo, u, ok? Vediamo lo discreto, quindi pensate che ci siano\nin realtà quanti dei pallini qui, ok? E voglio calcolare la risposta forzata del sistema\nin questo tempo qua. Facciamo la risposta forzata in rosso, ok? In questo tempo qua.\nSe il sistema è lineare tempo in variante, cosa significa? Significa che in realtà questo\nu che sto disegnando in blu qui lo posso pensare come un insieme di u, vero? Un primo u è\nquesto qua, sempre zero, questo e così. Un altro u sarà sempre zero, questo e così.\nCi siamo? La vedete? Adesso la risposta forzata sarà fondamentalmente cosa, sarà la somma\ndelle risposte che io tengo ad ogni individuale, ad ogni u individuale, vero? Perfetto. Se\nè tempo in variante, il fatto che questo sia le dieci di mattino o il primo luglio\ndel mille non cambia, ok? Vero? Poi il fatto che sia lineare significa che se io prendo\nquesto u singolo, prendiamo questo u singolo qua, ok? Cusate. Se prendiamo questo u singolo\nqua e guardiamo, quindi chiamiamolo u-1 perché fondamentalmente è l'ingresso che\nho un step prima. Se io faccio tre volte questo u, questo mi produrrà tre volte la risposta\nforzata che otterrei guardando il posto prima. Ci siamo? E la stessa meno due, eccetera,\neccetera. Perfetto. Poi essendo lineare, se io prendo un unico u al meno tau, ok? Questo\nmi produrrà come risposta al meno tau. Il, come si dice il contributo di questo qua\nsarà un certo, chiamiamolo alpha-mino tau, vero? Cioè pensate di fare fondamentalmente\navere un. Sto calcolando la risposta forzata, guardando dal punto di vista pratico, soltanto\nun ingresso che è un segnale unitario che va, che è diverso da zero, soltanto lo step\nprima, ok? Vi verrà fuori un numero, vero? Chiamiamo questo numero alfa-mino tau, questo\nfacciamo meno uno, quindi questo qua è alfa-mino uno, mettiamolo qua. Facciamo finta che per\nquesto sistema qua è sto valore qua, ok? Ci siamo, avete ricapito cosa sto facendo? Poi\nfacciamo finta che ha un altro, un altro input, un input che è unitario soltanto uno step prima,\ncioè scusate, due step prima. Questo mi darà un altro contributo. E vedete cosa sto facendo.\nCosa stiamo facendo? Facciamo un esempio pratico. Se io avessi un ingresso che è fatto tipo 3U,\nfacciamo che questo sia 2, facciamo che questo sia 1.5. Allora, facciamo una trebella qua,\nalfa-alfa, il tau, meno uno, meno due, meno tre. Facciamo 2, 1.5, questi li vedremo dopo. Se io il\nmio ingresso è fatto a sto punto, come? Due, uno, e voglio calcolare l'uscita qua,\nl'uscita qua, considerando questo ingresso qua e questi quei efficienti qui, cosa sarà?\nSarà 2 per 1.5 più 1 per 2. Vero? Mi state seguendo, 1, 3. Dal punto di vista pratico,\nad ogni step prima, ad ogni step fondamentalmente nel passato, avrò un peso che sava il peso di\nquel ingresso che contribuirà alla mia risposta forzata. Quindi, i passaggi cosa sono? È lineare\nquindi l'ingresso totale e lo divido in pezzettini. Ad ogni pezzettino siccome il lineare deve essere\nassociato a un peso, quindi abbiamo una specie di finestra di pesi, fatemi a disegnare così a\nsto punto, a finestra di pesi. Cosa sta succedendo questa finestra di pesi qua? Questa finestra di pesi\nqua siccome che vada a moltiplicare questo per questo, più questo per questo, più questo per\nquesto, più questo per questo, io in realtà quello che sto facendo è una moltiplicazione fra\nquesto segnale qua e l'ingresso, ma io potrei pensare che questo segnale qua, questa finestra\ndi pesi che dopo dovrò spostare avanti indietro, se voglio considerare altri risposte forzata\nda altri tempi, questa finestra di pesi qua, in realtà è la nostra H flippata. Per questo\ntempo, che manierà da flippo? Perché noi abbiamo ogni volta, fatemi fare un altro pagina, ogni volta\nche abbiamo un ingresso e considero questo ingresso fatto come individui ingressi, io l'operazione\ndi per trovare da questo ingresso e le proprietà del sistema l'uscita forzata, io fondamentalmente\ndecompongo e moltiplico per questa finestra di pesi, questa finestra di pesi è la risposta\nimpulsiva. Per essere lineare tempo in variante deve esistere questa finestra di pesi che\nschifta avanti indietro, dal punto di vista pratico invece di considerare una finestra\ndi pesi che schifta avanti indietro mi conviene considerare questa H che chiamerò risposta\nimpulsiva. Perché risposta impulsiva? Perché se io do U che è fatto così, non so se\navete mai visto questa salava qua, se U è 1 al tempo 0 e niente, cosa sta succedendo\ndal punto di vista di convoluzione? Se calcule la risposta forzata a meno 1 avrò una finestra\nmessa così, il prodotto è 0, vero? Se calcule la risposta forzata in 0 avrò la finestra\nmessa così, il prodotto cosa sarà? Sarà soltanto il primo peso, vero? E vedrò il\nprimo peso. Poi al tempo 1 cosa sarà? La finestra sarà messa così, moltiplico, tutto\nottengo cosa? Il secondo peso. Facendo andare avanti questa finestra di pesi, io dal punto\ndi vista pratico come risposta forzata nel tempo vedrò effettivamente i pesi.\nQuesto non è discretto. Nel continuo è un po' più complicato nel senso che bisogna\npassare all'operazione di limite, bisogna considerare i delta, quindi formalmente un\npo' più complicato, ma questo è il discorso. Ci siamo? È stato chiarito. Se non è stato\nchiarito, lo ricordiamo. Uno, tre, uno, andiamo avanti, tre lo ricordiamo. Perciò.",
    "chunk_count": 60,
    "merged_unit_count": 60,
    "detected_languages": [
      "it"
    ]
  },
  "merged_transcript": {
    "session_id": "L25P04_1files",
    "units": [
      {
        "unit_id": "merged_unit_00001",
        "chunk_id": "audio_source_001_chunk_0001",
        "chunk_occurrence": 1,
        "audio_source_id": "audio_source_001",
        "source_order_index": 1,
        "input_source_id": "source_001",
        "start_seconds": 0.0,